,Job position,Company,Location,Dimension,Candidates,Post time,JavaScript,Python,C#,Ruby,.Net,SQL,Angular.js,React.js,Node.js,Java,Links,Body
16,Senior Full-Stack Engineer,OutSystems,"Lisboa, Lisboa, Portugal",Check link,4 candidatos,Anunciada há 1 mês,1,0,1,0,0,0,0,1,0,0,https://www.linkedin.com/jobs/view/2357142176/?eBP=JOB_SEARCH_ORGANIC&recommendedFlavor=SCHOOL_RECRUIT&refId=F4%2FKsowixdRZ70AgiXBzlg%3D%3D&trackingId=Yh4HIk3p%2FylGtpWJFz9%2F%2FA%3D%3D&trk=flagship3_search_srp_jobs,about outsystems  outsystems r&d is known for working on highly complex problems while focusing on keeping the product extremely easy to use  allowing us to lead the future of software development  we expect our engineers to help us drive the software development landscape changes by disrupting the way modern software is built   the outsystems engineering team has developed its own visual coding language  compilers to transform it into optimized high code  smart assistant ai mechanisms to accelerate development  truechange   code flow optimization mechanisms  and additional paas services that allow customers to easily develop powerful applications  the team empowers customers to tame all the hassles of complex software development under a powerful yet simple-to-use platform   to apply to this position  you need to be willing to build a product used across the globe by some of the largest and most complex organizations  like toyota  salsa jeans  thinkmoney  logitech  and others  you’ll build a product that will be used by developers of any industry  enabling the development of software used by millions of end-users across the globe  with auto-scaling capabilities  the product also allows customers to build very complex core systems that deal with complex business logic and integrations with legacy systems based on product extensibility sdks   full-stack engineer at outsystems we are looking for full-stack engineers who know how to build high performant web-based applications to help improve our platform to take away all the complexity of application development from our customers  outsystems mission is to make software development available to everyone  so you can expect big challenges ahead   as a full-stack  we expect you to work with your team in designing and developing features that will be used by the outsystems developers all over the world  you will be able to work end-to-end in our platform  from the developer experience provided in our ide to the runtime representation of each feature   we also expect you to innovate and bring development best practices into your team while you keep looking at the upcoming technologies and frameworks   do you        feel that you are a javascript or c# expert?     enjoy challenging yourself to design systems that scale for millions of requests?     like to deal with complexity and uncertainty?     enjoy taking on new challenges and stepping out of your comfort zone?     look for a place where you can constantly create collaboration opportunities?     wake up eager to brainstorm with other colleagues to solve the next challenge?   tick all the boxes? you might just be the person we’re looking for   what we're looking for: bachelor’s or master's degree in software engineering  computer science  or similar  if you do not have one but you have a solid understanding of computer science and software engineering fundamentals  we still want to hear from you  more than 4 years of javascript and c# experience or equivalent  solid understanding of web architectures  experience with testing frameworks and methodologies  experience with react or typescript is a plus  passion to analyze and design elegant solutions for high-tech problems  experience in mentoring more junior software engineers  drive to innovate and bring development best practices into your team  drive to understand what are the upcoming technologies and frameworks  good communication skills and fluency in english    what can you expect from outsystems: the possibility to disrupt the software development market  a company that cares about employees wellbeing and provides a safe and comfortable work environment  even during adverse times  a world-class software engineering team with peers and leaders that are inspired to learn and share what they know  a fast-growing company that provides many opportunities for you to grow  fun from day one: a relaxed work environment  colleagues from diverse backgrounds and with a diverse range of interests  fun company events   curious about outsystems culture? find out more in the small book of the few big rules  nível de experiência não aplicável setor tecnologia da informação e serviços software internet tipo de emprego tempo integral funções de trabalho engenharia tecnologia da informação
18,.Net Developer,Apside,"Aveiro, Portugal",1.001-5.000 funcionários,25 candidatos,Anunciada há 1 semana,0,0,1,0,1,1,1,1,0,0,https://www.linkedin.com/jobs/view/2365543180/?eBP=JOB_SEARCH_ORGANIC&recommendedFlavor=ACTIVELY_HIRING_COMPANY&refId=F4%2FKsowixdRZ70AgiXBzlg%3D%3D&trackingId=%2B7xm8JZB%2BIZbI%2BAKHAedPw%3D%3D&trk=flagship3_search_srp_jobs,4 main values which guide us daily commitment at every step transparency for effective communication conscientious and locally accessible partners sharing the apside spirit  key responsibilities: develop and maintain new and existent applications develop with clean code principles in mind work within multidisciplinary and multi geographically distributed teams work in international projects availability to travel sporadically   main skills: bs   associate degree in computer science or similar minimum of 3 4 years of experience using  net   net core  c# or asp net  vue    react and skills valued in angular  frontend full stack  knowledge about xaml  wpf and mvvm good knowledge of sql  mysql  sql server or other relational db  knowledge of soa rest architecture micro services architecture  azure or cloud experience is valued scrum experience or in other agile methodology git versioning experience fluent spoken and written english  written and spoken french is a plus team player   our job offer: negotiable salary good working environment young and dynamic team challenges and opportunities to grow personally career management work with international projects opportunities to travel nível de experiência pleno-sênior setor tecnologia da informação e serviços tipo de emprego contrato funções de trabalho outro
20,Junior to mid-level C++ Developer - Train Planning & Dispatching Systems (m/f/d),Siemens,"Aveiro, Aveiro, Portugal",Check link,0 candidatos,Anunciada há 3 semanas,0,0,0,0,0,0,0,0,0,0,https://www.linkedin.com/jobs/view/2397277570/?eBP=JOB_SEARCH_ORGANIC&recommendedFlavor=ACTIVELY_HIRING_COMPANY&refId=F4%2FKsowixdRZ70AgiXBzlg%3D%3D&trackingId=SISCayKTnqmK6Dte4YaMYw%3D%3D&trk=flagship3_search_srp_jobs,siemens mobility provides integrated mobility solutions for urban  interurban and logistics for efficient transportation of passengers and goods   with digitalization we enable mobility operators worldwide to make trains and infrastructure intelligent  our business segment intermodal solutions  ims  creates and develops innovative high-quality software for trip and train planning  mobile ticketing and comprehensive mobility as a service  maas  solutions   we share one common goal: enhancing the passenger experience with our combined power for the future of mobility   siemens is setting up in aveiro  a new software development center targeting intelligent solutions for the future of mobility  we want you to join our team in the capacity of:  junior and mid-level c   developer train planning and dispatching systems  m f d   your role  conceptualize  develop and implement high-quality software modules of a leading client-server capacity planning and timetabling system to serve our train operator customers and the public transportation industry  enhance existing software modules  test and apply bug fixing methods  based on your skills and experience an extensive range of software development tasks in either back end  architecture  full stack development  user interface or feature development in close cooperation with the customer will be at your disposal   your profile  university degree in computer science  informatics  or comparable  or otherwise gained experience in software development  preferably experience in c  11 14 17  design patterns and up to date methods and tools for software development  experience with qt5  docker and git is a plus  team player with passion for quality  to transform complex and manifold requirements into efficient  sustainable and modular software components  fluent in written and spoken english  german language is a plus   various positions available – please apply   organization: siemens mobility  company: siemens mobility  unipessoal lda  experience level: early professional  job type: full-time nível de experiência não aplicável setor manufatura de eletroeletrônicos tipo de emprego tempo integral funções de trabalho tecnologia da informação
22,Microsoft Dynamics CRM Consultant,Capgemini,"Lisboa, Lisboa, Portugal",Check link,8 candidatos,Anunciada há 3 meses,0,0,1,0,0,0,0,0,0,0,https://www.linkedin.com/jobs/view/2295692405/?eBP=JOB_SEARCH_ORGANIC&recommendedFlavor=SCHOOL_RECRUIT&refId=F4%2FKsowixdRZ70AgiXBzlg%3D%3D&trackingId=rDzrnoWn88mBbSain58blw%3D%3D&trk=flagship3_search_srp_jobs,we are hiring microsoft dynamics crm developer!  at capgemini portugal  you will work with some of the industries leading experts  with cutting edge technologies  and a supportive community  you’ll be challenged daily and given strong responsibility from day one   if you have at least 2 years of experience working with microsoft dynamics crm  this opportunity is for you!  we are looking for unrivalled passion for everything microsoft dynamics focused  expertise in ms dynamics 365  crm   more than just an interest in ms dynamics 365 online and office 365  bottoms up understanding of crm – c# development through to architecture design  full life cycle experience on a microsoft dynamics projects  knowledge of microsoft dynamics crm sdk  visual studio and team foundation server  have experience in the broader msft stack  azure  sharepoint  biztalk  and worked to an agile methodology   what are we offering? the chance to work on interesting challenging projects for national and international clients  the opportunity to work in great  dynamic teams  health and life insurance  the possibility of investing on certifications and training  a permanent contract with an attractive compensation package and benefits  nível de experiência júnior setor tecnologia da informação e serviços software recrutamento e seleção tipo de emprego tempo integral funções de trabalho tecnologia da informação
24,Full Stack Senior Software Programmer,"Sincelo - Sistemas de Informação, Lda","Porto, Portugal",Check link,2 candidatos,Anunciada há 4 semanas,0,0,0,0,0,0,0,0,0,0,https://www.linkedin.com/jobs/view/2362668480/?eBP=JOB_SEARCH_ORGANIC&refId=F4%2FKsowixdRZ70AgiXBzlg%3D%3D&trackingId=rwF6aAzgCB30Ak90jX6ncQ%3D%3D&trk=flagship3_search_srp_jobs,anunciada por rui ribeiro cto at sincelo  sistemas de informação lda  envie inmail the ideal candidate is a self-motivated  multi-tasker  and demonstrated team-player  you will be a lead developer responsible for the development of new software products and enhancements to existing products  you should excel in working with large-scale applications and frameworks and have outstanding communication and leadership skills    responsibilities writing clean  high-quality  high-performance  maintainable code develop and support software including applications  database integration  interfaces  and new functionality enhancements coordinate cross-functionally to insure project meets business objectives and compliance standards support test and deployment of new products and features participate in code reviews  qualifications bachelor's degree in computer science  or related field  3  years of relevant work experience expertise in object oriented design  database design  and xml schema experience with agile or scrum software development methodologies ability to multi-task  organize  and prioritize work nível de experiência júnior setor tecnologia da informação e serviços tipo de emprego tempo integral funções de trabalho engenharia tecnologia da informação
26,Full-Stack DeveloperPromptly - Trofa,Proef,"Porto, Porto, Portugal",Check link,1 candidato,Anunciada há 3 meses,1,1,1,1,0,1,0,0,0,1,https://www.linkedin.com/jobs/view/2305248266/?eBP=JOB_SEARCH_ORGANIC&recommendedFlavor=SCHOOL_RECRUIT&refId=F4%2FKsowixdRZ70AgiXBzlg%3D%3D&trackingId=FZHkTFF220AX%2Fuw5CrN%2FfQ%3D%3D&trk=flagship3_search_srp_jobs,full-stack developer promptly - trofa 99 full-stack developer promptly - trofa promptly is an ehealth startup company that aims to revolutionize healthcare by making health outcomes available to everyone  within one year  we aim to be conducting several pilot-studies in hospitals and healthcare systems in different geographies and by 2020 we will be reaching 1m patients in at least 4 different countries  we are currently seeking a full-stack developer who wants to help us build a product that patients and clinical teams love  and that will be at the core of making excellent outcomes care a reality in portugal and worldwide   job description  duties & responsibilitiesyou have to be a self-paced developer  we do not micromanage here  you will be on a fast learning environment and we expect that you learn and teach as much as you can  we expect that you help us to build beautiful  and high-performance applications with a modern software stack  duties include  but are not limited to: write good  clean and testable code attention to detail being proud of the code you write and the product you build review code and help each other being better being self-driven  have a pro-active mind and sense of ownership collaborate with a team of other talented people use best practices and excel at what you do troubleshooting and problem solving using high performant solutions choose the right tool tech-stack for the job qualifications and work experience have experience with backend languages python php ruby c# java etc  python is a plus  have experience with javascript experience with mvc frameworks  django is a plus  experience with oo programming and software design patterns knowledge on test-driven development techniques experience with continuous delivery development process is a plus knowledge on sql and nosql databases what we offer be part of a team that will make healthcare better! fantastic working environment  with a young and enthusiastic  and talented team ownership  defining your own career pathway competitive salary and other benefits  health insurance  gym  office food …  unique growth opportunity be one of the firsts on a fast-growing team candidate-se nível de experiência não aplicável setor construção recrutamento e seleção recursos humanos tipo de emprego tempo integral funções de trabalho outro
28,Senior Full Stack Engineer,Value Negotiation Technologies,Portugal Remoto,Check link,7 candidatos,Anunciada há 1 semana,1,0,1,0,1,1,0,0,0,0,https://www.linkedin.com/jobs/view/2387790040/?eBP=JOB_SEARCH_ORGANIC&recommendedFlavor=JOB_SEEKER_QUALIFIED&refId=F4%2FKsowixdRZ70AgiXBzlg%3D%3D&trackingId=ZLSOUZ%2BND9lNo0%2FnP0n2Kg%3D%3D&trk=flagship3_search_srp_jobs,anunciada por andre doria automating commercial negotiations - hiring! envie inmail don’t you hate it when you lose a flight and don’t get your deserved compensation? come help us taking off with the next automated ticket reimbursement negotiation platform    among other pioneering customer negotiation systems   value negotiation technologies  vn tech  is the new born technological arm of value negotiation©  a boutique advisory firm from insead professors and negotiation experts who have developed a smart win-win approach to collaboratively solving disputes and negotiations in a positive way  world-wide   the small team has long expertise  practical and academical  in both peace and business negotiations  having successfully advised heads of state  ceos and senior staff of large corporations   we have been translating this experience into advanced technology  simulation  optimization  data analysis  and soon  machine learning  to empower commercial teams and call centers to achieve better deals through quick processes for maximum satisfaction   today  we are focusing our already commercially piloted technology to the passenger refund process  which is known to be highly inefficient   we are seeking a top full-stack senior developer  for which we have the following requirements:  requirements full-stack proficiency and autonomous work capability minimum 6 years of experience working as a c# developer professionally knowledge of asp net core and entity framework knowledge of frontend essentials  html  css  javascript  experience in software architecture critical thinking professionalism and reliability comfort with numbers excellence with people nice to have experience with sql server experience with blazor knowledge of azure cloud services experience in the airlines   call center industry interest for  and knowledge of bots  ai and big data we offer a competitive salary possibility of a stock options plan a world-class course on negotiation skills exposure to a very experienced team of negotiation professors and business advisors flexibility in the work location  with preference for porto  portugal  nível de experiência júnior setor software tipo de emprego tempo integral funções de trabalho engenharia tecnologia da informação
30,Senior Web Developer (Angular),BNP Paribas,"Lisboa, Lisboa, Portugal",Check link,4 candidatos,Anunciada há 3 meses,1,0,1,0,0,0,1,0,0,1,https://www.linkedin.com/jobs/view/2279779498/?eBP=JOB_SEARCH_ORGANIC&recommendedFlavor=SCHOOL_RECRUIT&refId=F4%2FKsowixdRZ70AgiXBzlg%3D%3D&trackingId=jG22506qCSUvvcGTVucdxA%3D%3D&trk=flagship3_search_srp_jobs,bnp paribas is a leader in the eurozone  and a prominent international banking institution with strong roots in europe's banking history  it has a presence in 71 countries  with 200 000 employees - including more than 150 000 in europe and 6 000 in portugal alone  bnp paribas is present in portugal since 1985  having been one of the first foreign banks to operate in the country  today  the group has several entities operating directly in this territory  offering a wide range of integrated financial solutions to support its clients and their businesses  thanks to its international presence and regular and close collaboration among its businesses  bnp paribas has the resources to support all clients -- individuals  entrepreneurs  smes  large corporates  institutional investors and community organisations -- with financing  investment  savings and protection solutions that help make their projects a success  bnp paribas holds key positions in its three core operating divisions: domestic markets and international financial services for retail banking and specialised financial services  and corporate & institutional banking for corporate and institutional clients  the mission of risk is to provide senior management of the group and of the operating divisions  with full transparency and dynamic analysis of the risk and clients managed by corporate and investment banking  cib  and investment solutions  is  business units  as per the scope detailed below   the scope of risk is on market and liquidity risks: it is group-wide  risk comprehensively covers the cib capital markets activities  alm treasury as well as the is business units  on counterparty risk: it is group-wide  risk covers all counterparty risks arising from derivative and repo transactions  on credit risk: credit analysis and approval for all financial institutions  including funds and spvs   sovereigns  wealth management clients and other is private clients  on insurance risk: risks generated by insurance activities  depending on mandates given  risk also assumes  directly or indirectly  responsibilities on the above risk categories in specific areas of the retail business units  risk contributes to the definition of the group's risk appetite  its risk decision-making process and the optimization of capital allocation to support the development of the operating divisions  the risk era systems team is part of risk  its mission consists in providing the bank with a comprehensive capital markets risk system used to calculate market and counterparty risk capital figures using advanced methods and to support the needs of users for risk analysis  risk reporting and the credit process  in this context  the data governance tool  dgt  was created to monitor data quality within risk era systems  it came as an answer to bcbs 239 and has now become a key asset for risk era systems and for risk in general   role and responsibilities  we are looking for an html5 based  angular   web developer responsible for the client side of our service  your primary focus will be to implement a complete user interface for a web application  with a focus on usability  flexible configuration and performance  your main duties will include creating modules and components and coupling them together into a functional application for risk business users  you will have responsibility for the artistic design  html templates  animations  css  and final html output  you will work in a team with other front and back-end developers  and communicate with the rest api using standard methods  the successful candidate will be expected to fulfil the role of a data governance tool web developer as follows: be part of a growing team that is at the heart of our investment in regulatory and business driven change rapidly prototyping solutions to quickly prove disprove new concepts delivering a complete front end application ensuring high performance in a multi-browser environment writing testable  idiomatic  and documented javascript  html and css working across the full client stack  including ui design  html layout  and javascript coding cooperating with the back-end developers in the process of building the restful api communicating with web services  profile master's degree in computer science  finance or related field data or risk related business analysis experience is preferred experience of market and or counterparty risk exposure to the practical issues of data loading  validation and management proficiency with javascript  css and html5 deep knowledge of modern javascript frameworks  such as angular   and commonly used javascript tooling and modules based on extensive work experience creating self-contained  reusable  and testable modules and components extensive knowledge of css and   methods for providing performant visual effects thorough understanding of multi-tier platforms  including database  api  caching layer  proxies  and other web services writing asynchronous code  and an understanding of parallel server architectures basic understanding of back-end technologies  such as java  preferred  or c# strong analytical skills with a creative and flexible approach to problem solving good knowledge of english  please note that only applications submitted in english will be considered  in case you are selected for this role  further documentation will be requested to support your hiring process  bnp paribas is an equal opportunity employer and proud to provide equal employment opportunity to all job seekers  we are actively committed to ensuring that no individual is discriminated against on the grounds of age  disability  gender reassignment  marriage or civil partnership status  pregnancy and maternity  race  religion or belief  sex or sexual orientation  equity and diversity are at the core of our recruitment policy because we believe that they foster creativity and efficiency which in turn increase performance and productivity  we strive to reflect the society we live in  while keeping with the image of our clients  nível de experiência júnior setor bancos seguros serviços financeiros tipo de emprego tempo integral funções de trabalho engenharia tecnologia da informação
