,Job position,Company,Location,Dimension,Candidates,Post time,JavaScript,Python,C#,Ruby,.Net,SQL,Angular.js,React.js,Node.js,Java,Links,Body
32,Senior Full-Stack Software Engineer (Portugal),Amyris,"Porto, Porto, Portugal",Check link,0 candidatos,Anunciada há 1 mês,1,1,0,0,0,0,0,1,0,1,https://www.linkedin.com/jobs/view/2366776151/?eBP=JOB_SEARCH_ORGANIC&recommendedFlavor=ACTIVELY_HIRING_COMPANY&refId=F4%2FKsowixdRZ70AgiXBzlg%3D%3D&trackingId=NcbwL2KtAzWhP8dD2Fm5bg%3D%3D&trk=flagship3_search_srp_jobs,amyris is the integrated renewable products company that is enabling the world's leading brands to achieve sustainable growth  amyris applies its innovative bioscience solutions to convert plant sugars into hydrocarbon molecules and produce specialty ingredients and consumer products  the company is delivering its no compromise™ products and services across a number of markets  including specialty and performance chemicals  flavors and fragrances  cosmetics ingredients  pharmaceuticals  and nutraceuticals   we are now opening an office in porto and are looking for software developers to join our team of smart  highly motivated individuals dedicated to working together to create a cleaner  more sustainable future   this project is co-financed by portugal 2020 under the operational program for competitiveness and internationalization through the european regional development fund  feder    responsibilities the candidate will primarily be responsible for designing and implementing cloud-based tools and services that will facilitate building and testing microbial strains used in industrial biotechnology assessing requirements  proposing techniques or technologies for accomplishing them design and implement cloud-based services and other back-end tools work with a cross-disciplinary group of computational biologists and software engineers to implement solutions  qualifications a bs   ms in computer science or a related field such as mathematics  physics  computational biology  electrical engineering  bioengineering at least 5 years of experience experience with java and python  preference for java or similar  deep experience building back-end api’s for web-based tools in java or a similar language experience using relational databases as a data store for a software product solid programming skills building ui components in javascript 2  years of experience developing react    or similar front-end framework  based applications strong sense of what makes for good ui design user experience strong sense of ux   interaction   visual design strong  but flexible  opinions on the right way to build and deploy modern web-based tools  and the skills to work closely with a small team to build and deploy them strong communication skills strong working competency in english  nice to have experience working on large projects with multiple contributors  automated software tests  distributed vcs  and continuous integration demonstrated experience delivering completed software products experience leading small technical teams experience with functional programming a strong sense of software best practices experience deploying in a cloud environment experience building web-based  saas applications experience with unix based operating systems experience or background in biological science  perks competitive salary based on your skills  x14  interesting international projects in cutting-edge technology great work environment flexible work schedule budget for events meal allowance training and education budget coffee and snacks provided throughout the day!  amyris bio products portugal  unipessoal  lda  is the controller of the processing of personal data concerning your application according to regulation  ue  2016 679  general data protection regulation or “gdpr”    the personal data processed in the context of this tender is intended for selection and recruitment process under the tender  in order to verify that the candidate meets the requisites established in the tender and the legally applicable legislation for hiring  a candidate may oppose the processing of their personal data  however  opposition by the candidate to the processing of personal data will render the admission of the application unviable and  consequently  we will be unable to consider your application   when indispensable to comply with the obligations of amyris bio products portugal  unipessoal  lda   the personal data of the candidate  the “data subject”  as such term is defined in applicable gdpr  may be communicated to third-parties  namely  the ani-agência nacional de inovação  s a and aicep - agência para o investimento e comércio externo de portugal  this data may also be processed by other entities which amyris bio products portugal  unipessoal  lda  has subcontracted for purposes of assisting us in this recruitment process  including universidade católica portuguesa   amyris bio products portugal  unipessoal  lda  is a wholly owned subsidiary of amyris  inc   a corporation based in the united states with global operations in the united states and brazil and the personal data of the candidate may be processed globally  to the extent strictly necessary to enable an employment hiring determination  therefore  a candidate submitting a job application acknowledges that his her personal data in relation to this tender may be transferred to and maintained on servers or databases of amyris companies located outside portugal and the european union  specifically  the united states and brazil    the laws in the united states and brazil may not be as protective of data subject’s privacy as those in portugal for purposes of the transfer of personal data to these countries outside the european union  for which amyris  inc   on behalf of itself and amyris brazil  its wholly owned subsidiary  and amyris bio products portugal  unipessoal  lda  have entered into “standard contractual clauses”  an agreement with terms that have been pre-approved by the eu commission to contractually ensure an adequate level of protection for international transfers of personal data to controllers or processors established in third countries  as the case may be  the candidates may request further information on the transfer of data within the amyris companies   the personal data may be kept for the legally allowed period   the data subject is entitled to oppose processing  or to verify  correct  erase  request access to or a copy of  and limit the use of the data collected  however  the exercise of such rights may be excluded when the personal data is used to protect public interest  namely in the detection and prevention of crimes or when subject to professional rules of confidentiality  for purposes of exercising the respective rights  contact the amyris bio products portugal  unipessoal  lda   through the email amyrisportprivacy@amyris com  the data subject is always entitled to contact and file a complaint with the comissão nacional de proteção de dados   amyris bio products portugal  unipessoal  lda is the controller of the processing of personal data according to regulation  ue  2016 679  general data protection regulation    the personal data processed in the context of this tender is intended for the preparation of the tender and shall be also processed by universidade católica portuguesa to which amyris bio products portugal  unipessoal  lda has subcontracted the processing of this recruitment process   the personal data processed in the context of this tender is intended for the preparation of the tender and shall verifying compliance  by the candidate  of the requisites established in the legally applicable legislation for hiring  opposition by the candidate to the processing of personal data will render the admission of the application unviable and  consequently  also of the analysis and evaluation of the application and eventual hiring   when indispensable to comply with the obligations of amyris bio products portugal  unipessoal  lda  the personal data of the data subject may be communicated to third-parties  namely  the ani-agência nacional de inovação  s a and aicep - agência para o investimento e comércio externo de portugal  this data may also be processed by other entities which amyris bio products portugal  unipessoal  lda has subcontracted for such purpose besides ucp–universidade católica portuguesa   the personal data may be kept for the legally allowed period   the data subject is entitled to oppose processing  verify  correct  erase and limit the use of the data collected  however  the exercise of such rights may be excluded when the personal data is used to protect public interest  namely in the detection and prevention of crimes or when subject to professional rules of confidentiality  for purposes of exercising the respective rights  contact the amyris bio products portugal  unipessoal  lda  through the emailmuller@amyris com  claudia muller   the data subject is always entitled to contact and file a complaint with the comissão nacional de proteção de dados  nível de experiência júnior setor biotecnologia tipo de emprego tempo integral funções de trabalho engenharia tecnologia da informação
34,Oferta De Emprego: .Net Fullstack Developer,Red IT,"Porto, Porto, Portugal",Check link,0 candidatos,Anunciada há 4 dias,0,0,1,0,1,1,1,0,0,0,https://www.linkedin.com/jobs/view/2398367801/?eBP=JOB_SEARCH_ORGANIC&recommendedFlavor=SCHOOL_RECRUIT&refId=F4%2FKsowixdRZ70AgiXBzlg%3D%3D&trackingId=N1QVFcnGdklXY9FQ69kZYQ%3D%3D&trk=flagship3_search_srp_jobs,distrito: porto - concelho: porto  oferta net fullstack developer » red it » ref: 7085331 » 2-11-2020 » porto » informática   programação    detalhe da oferta  esta pode ser a tua oportunidade  tu decides  keywords:  net  c#  html  css  sass  angular  typescript  sql server   net core  se tens formação base em engenharia informática ou equivalente  experiência superior a 2 anos em desenvolvimento c# net conhecimentos de  net core  experiência com html  css e sass experiência com angular e typescript conhecimentos de modelação de dados em sql server fluência em inglês  e se estás na zona norte e procuras uma oportunidade como  net fullstack developer  decide pelo melhor  a equipa ? é top  queres apostar? o acompanhamento ? follow up contínuo  estamos sempre ao teu lado  o espírito ? trabalhar e ser feliz? provamos-te que é possível! o desenvolvimento profissional ? um novo mundo à tua disposição  vem escolher por onde ir  wolfpack ? descobre o que é ser red  todos os dias!  ainda não te convencemos? vamos tirar-te todas as dúvidas  responder às tuas questões e mostrar-te que porque não há melhor equipa do que a nossa  candidata-te agora através de *** candidatura online *** e vem conhecer a red   what drives you? descobre o que nos move em nível de experiência assistente setor tecnologia da informação e serviços software internet tipo de emprego tempo integral funções de trabalho engenharia tecnologia da informação
36,Senior Software Engineer - Portugal,"RealPage, Inc.","Matosinhos, Porto, Portugal",5.001-10.000 funcionários,11 candidatos,Anunciada há 3 semanas,1,0,1,0,1,1,1,1,0,0,https://www.linkedin.com/jobs/view/2315500458/?eBP=JOB_SEARCH_ORGANIC&recommendedFlavor=ACTIVELY_HIRING_COMPANY&refId=F4%2FKsowixdRZ70AgiXBzlg%3D%3D&trackingId=B4VOQwnsXNfSnesT%2FWj1VQ%3D%3D&trk=flagship3_search_srp_jobs,who we are  realpage is changing the technology real estate industry and our teammates know how to think big and leave their mark  if you want to join a globally progressive and inclusive company devoted to excellence  we are looking for you!  we are the leading global provider of software and data analytics to the real estate industry  we navigate clients toward the right decisions with data and technology insights they can only get from realpage  serving our clients is our highest priority and realpage teammates are our greatest asset   come join a team where your work makes an impact every day!  about the team  buildium is looking for smart  driven  enthusiastic software engineers to join our team in porto  portugal  our core product is an all-in-one property management platform designed for real estate professionals to take control of their business by streamlining their accounting  maintenance  communication  and leasing processes in the cloud   as a senior software engineer  you'll be part of a cross-functional product team delivering new features to our client base of over 18 000 property managers and housing associations  this is a great chance to be part of a growing organization that is dedicated to engineering best practices and processes as well as continually providing opportunities for professional growth   what you’ll do work in two-week sprints building new features and enhancing existing features of the buildium platform using technologies like c#  asp net web api  angular  and mysql  full stack design and development with a focus on maintainability  usability  scalability and performance  be a positive influence on the team through technical reviews  collaborating with other developers on the team  and ensuring adherence to coding and testing standards  work closely with product managers to understand the future business direction with the goal of architecting the platform optimally  work closely with technical leads and other stakeholders to develop project plans and participate in resource planning  contribute ideas and work on solutions to evolve our ci cd processes and tools  maintain a high awareness of industry issues and trends  particularly in regard to web technologies   net  microservices  cloud computing  aws   and automated unit testing  participate in our engineering guilds  focus groups  and tech talks to contribute to the research and implementation of new technologies  tools  and architectural patterns   required knowledge skills abilities fluency in english with strong written and oral communication skills 5  years of experience in developing customer facing software self-motivated and willing to work through problems without obvious answers hands-on experience with c#   net 4 5  net core  asp net mvc web api and javascript frameworks like angular  react  and or vue hands-on experience working with creating and consuming rest web services and apis experience working with writing sql queries and designing databases  mysql is a plus  understanding of source code management tools such as git  and the workflows associated with them  branching and merging  excellent presentation and facilitation skills experience with aws docker or similar cloud platforms also a plus  note: buildium does not have an official office in portugal and any job offers will be made by upperhand software  unipessoal lda  upperhand software  unipessoal lda is not a realpage company   what we offer competitive salary health insurance free weekly team lunches  fresh fruit  coffee and drinks professional development opportunities diverse distributed team in portugal  usa and india remote-friendly environment working at buildium is unlike any other gig you've ever had  with offices in the us  portugal and india  you will be interacting daily with colleagues distributed all around the world  we’re casual  open  innovative and collaborative  as a company that empowers their employees to do the right thing  you will find that buildium’s drive to be the best is contagious   buildium is an equal employment opportunity employer and considers qualified applicants without regard to gender  sexual orientation  gender identity  religion  race  veteran or disability status  we celebrate diversity and are committed to building an inclusive work environment where all employees feel a sense of belonging while bringing their authentic self to the table and being valued for it   connect with us!  not ready to apply? connect with us for general consideration  nível de experiência júnior setor tecnologia da informação e serviços software serviços financeiros tipo de emprego tempo integral funções de trabalho engenharia tecnologia da informação
38,Senior Web Developer (Angular),BNP Paribas CIB,"Lisboa, Lisboa, Portugal",Check link,0 candidatos,Anunciada há 1 mês,1,0,1,0,0,0,1,0,0,1,https://www.linkedin.com/jobs/view/2392146413/?eBP=JOB_SEARCH_ORGANIC&recommendedFlavor=SCHOOL_RECRUIT&refId=F4%2FKsowixdRZ70AgiXBzlg%3D%3D&trackingId=XmM6bX7J8%2BWp9eIcP3LqIw%3D%3D&trk=flagship3_search_srp_jobs,bnp paribas is a leader in the eurozone  and a prominent international banking institution with strong roots in europe's banking history  it has a presence in 71 countries  with 200 000 employees – including more than 150 000 in europe and 6 000 in portugal alone   bnp paribas is present in portugal since 1985  having been one of the first foreign banks to operate in the country  today  the group has several entities operating directly in this territory  offering a wide range of integrated financial solutions to support its clients and their businesses   thanks to its international presence and regular and close collaboration among its businesses  bnp paribas has the resources to support all clients -- individuals  entrepreneurs  smes  large corporates  institutional investors and community organisations -- with financing  investment  savings and protection solutions that help make their projects a success  bnp paribas holds key positions in its three core operating divisions: domestic markets and international financial services for retail banking and specialised financial services  and corporate & institutional banking for corporate and institutional clients   the mission of risk is to provide senior management of the group and of the operating divisions  with full transparency and dynamic analysis of the risk and clients managed by corporate and investment banking  cib  and investment solutions  is  business units  as per the scope detailed below   the scope of risk is on market and liquidity risks: it is group-wide  risk comprehensively covers the cib capital markets activities  alm treasury as well as the is business units  on counterparty risk: it is group-wide  risk covers all counterparty risks arising from derivative and repo transactions  on credit risk: credit analysis and approval for all financial institutions  including funds and spvs   sovereigns  wealth management clients and other is private clients  on insurance risk: risks generated by insurance activities  depending on mandates given  risk also assumes  directly or indirectly  responsibilities on the above risk categories in specific areas of the retail business units   risk contributes to the definition of the group’s risk appetite  its risk decision-making process and the optimization of capital allocation to support the development of the operating divisions   the risk era systems team is part of risk  its mission consists in providing the bank with a comprehensive capital markets risk system used to calculate market and counterparty risk capital figures using advanced methods and to support the needs of users for risk analysis  risk reporting and the credit process   in this context  the data governance tool  dgt  was created to monitor data quality within risk era systems  it came as an answer to bcbs 239 and has now become a key asset for risk era systems and for risk in general   role and responsibilities  we are looking for an html5 based  angular   web developer responsible for the client side of our service  your primary focus will be to implement a complete user interface for a web application  with a focus on usability  flexible configuration and performance  your main duties will include creating modules and components and coupling them together into a functional application for risk business users   you will have responsibility for the artistic design  html templates  animations  css  and final html output  you will work in a team with other front and back-end developers  and communicate with the rest api using standard methods   the successful candidate will be expected to fulfil the role of a data governance tool web developer as follows: be part of a growing team that is at the heart of our investment in regulatory and business driven change rapidly prototyping solutions to quickly prove disprove new concepts delivering a complete front end application ensuring high performance in a multi-browser environment writing testable  idiomatic  and documented javascript  html and css working across the full client stack  including ui design  html layout  and javascript coding cooperating with the back-end developers in the process of building the restful api communicating with web services  profile master’s degree in computer science  finance or related field data or risk related business analysis experience is preferred experience of market and or counterparty risk exposure to the practical issues of data loading  validation and management proficiency with javascript  css and html5 deep knowledge of modern javascript frameworks  such as angular   and commonly used javascript tooling and modules based on extensive work experience creating self-contained  reusable  and testable modules and components extensive knowledge of css and   methods for providing performant visual effects thorough understanding of multi-tier platforms  including database  api  caching layer  proxies  and other web services writing asynchronous code  and an understanding of parallel server architectures basic understanding of back-end technologies  such as java  preferred  or c# strong analytical skills with a creative and flexible approach to problem solving good knowledge of english  please note that only applications submitted in english will be considered   in case you are selected for this role  further documentation will be requested to support your hiring process   bnp paribas is an equal opportunity employer and proud to provide equal employment opportunity to all job seekers  we are actively committed to ensuring that no individual is discriminated against on the grounds of age  disability  gender reassignment  marriage or civil partnership status  pregnancy and maternity  race  religion or belief  sex or sexual orientation  equity and diversity are at the core of our recruitment policy because we believe that they foster creativity and efficiency which in turn increase performance and productivity  we strive to reflect the society we live in  while keeping with the image of our clients   primary location  pt-11-lisbon  job type  standard   permanent  job  risks  education level  master degree or equivalent  > 4 years   experience level  at least 3 years  schedule  full-time  job number: 1908rsk3227 nível de experiência júnior setor tecnologia da informação e serviços bancos serviços financeiros tipo de emprego tempo integral funções de trabalho engenharia tecnologia da informação
40,Full-Stack Developer,Olisipo,"Lisboa, Lisboa, Portugal",Check link,0 candidatos,Anunciada há 1 mês,1,0,0,0,0,0,0,0,0,1,https://www.linkedin.com/jobs/view/2390630563/?eBP=JOB_SEARCH_ORGANIC&recommendedFlavor=SCHOOL_RECRUIT&refId=F4%2FKsowixdRZ70AgiXBzlg%3D%3D&trackingId=AbxcZMiPIiV0uClJITeGHg%3D%3D&trk=flagship3_search_srp_jobs,full-stack developer:olisipo descrição do emprego: full-stack developer id:  8959549  data   13-10-2020  empregador   olisipo  país da emprego   portugal  distrito   lisboa  categoria s    informática e tecnologias descrição da empresa a olisipo é uma das principais e mais sólidas referências nacionais como talent recruiter  talent builder e talent care na área das tecnologias de informação   a nossa missão é encontrar o melhor projeto para cada pessoa e  para cada empresa  o melhor talento na área das tecnologias de informação   #connectingitpeople  descrição do anúncio  apaixonados por desafios e ambiciosos na procura de soluções  a nossa it-tude é orientada pela excelência nos projetos e pela relação próxima com os nossos colaboradores  with our people  it works better!  desejamos um full-stack developer para integrar um projecto em lisboa   perfil 6 anos de experiência em java  experiência em arquitectura de sistemas  conhecimento em desenvolvimento back-end  hibernate  e front-end  javascript ou primefaces   experiência no desenvolvimento de webservices  conhecimento de polling services  pollers   experiência com bases de dados  capacidade de análise e criação de solução tendo em conta o sistema como um todo  autonomia no processo de desenvolvimento  oferece-se acompanhamento personalizado focado na gestão de carreira  formação e certificação contínua e personalizada  através do nosso learning center  solidez  confiança e crescimento  pacote salarial com benefícios competitivo  nível de experiência assistente setor tecnologia da informação e serviços software recrutamento e seleção tipo de emprego tempo integral funções de trabalho engenharia tecnologia da informação
