,Job position,Company,Location,Dimension,Candidates,Post time,JavaScript,Python,C#,Ruby,.Net,SQL,Angular.js,React.js,Node.js,Java,Links,Body
0,Node.js Developer,BOLD by Devoteam,"Lisboa, Portugal",501-1.000 funcionários,15 candidatos,Anunciada há 3 semanas,0,0,0,0,0,0,0,0,1,0,https://www.linkedin.com/jobs/view/2372050647/?eBP=CwEAAAF3Sp3PQw6XTTqPdvxppc16BgXso23X5NdIwr8160Gr2Q7hCmMxA82lKJ9BQ1EestySxXfqaRetbzPvRTKchqcyILLSjJZTDr3X8HSiRZr-9cLfLwHJe1XZoGbMMkVaW33EBpErRg44oHBQCSpfqVVe8sc6HgVieLSsIKmURK76CNyRfs_zl17VLkLEAXAtRRLHKcjafKWDDxrRBctr8QDCnCXxTaS4QVtYmhQZFCuOS8UbI1iZbMfJEMTBnwh3spDEGwbV30pGCvSKoRc65AtRvpwM9co6VLAf0UFwsr3gXq_snQ4Qd0HPcalpzs1YPLRo4qRxMIi-kMMSv5V99Fn28XxCeK7h&recommendedFlavor=SCHOOL_RECRUIT&refId=MkrxUvXcDbelL7EdEcOicw%3D%3D&trackingId=NLBQL5UHp6o4nSO4EwFzMg%3D%3D&trk=flagship3_search_srp_jobs,anunciada por sara sousa 2° talent spotter | hiring manager na bold by devoteam envie inmail the passion for what we do has no boundaries  our resilience is authentic and our courage is limitless when facing new challenges  we are proud of the culture we have built together  we are proud of our people at the service of technology  #techforpeople   our positioning about covid-19: due to the particular times we are facing and in order to protect our candidates and interviewers health and well being  all interviews will be held through video conference  we've created a remote onboarding process to ensure that new starters have all the knowledge they need to be able to start this new career phase   about the offer we are currently looking for a node   developer   the desired qualifications and skills are: bachelor’s degree in the it area or equivalent  experience as a backend full-stack engineer  experience with node   and typescript  good knowledge of restapis  experience testing applications  through unit  behaviour and integration tests  experience working with ci   cd pipelines  fluency in english  written and spoken    these are our mindsets and what you can expect from us:  fair & courageous we promote ask me anything sessions  a moment where any employee can question  suggest or share any topic live with the ceo  we have a referral program that financially recognizes our employees for helping the company grow  ambition & results we believe in supporting the personal and professional growth of our employees  that’s why we have a differentiated career path management supported by a transparent model  capable of identifying  developing and adding value to your skills  we’ve created a strategic gatherings concept  a moment where information about the company's performance is shared and where we discuss short-term prospects for the future  we are focused on a thought leadership program that aims to promote and develop our employees' talent  experience and passion for technology  learning & innovating we hold informal meetings to promote knowledge sharing moments between our employees and the technological community  we invest in the continuous training of our employees through technical and behavioral workshops  language classes  external funded training and certifications and by establishing partnerships with training providers  caring & sharing we created the blue angels  a social and environmental responsibility program that puts the solidarity of our employees at the service of the community  we love some good socializing moments and we hold as many as we can  from monthly themed meetings to family events  we never say no to a good party   about bold we are focused on developing and delivering innovative technological solutions through a unique combination of technology expertise and agility  maximizing business value for our clients  our focus when it comes to supporting our client’s digital journey is about clear choices that build & develop skills in a very targeted way   since 2018  bold by devoteam has been part of the devoteam group  a global leading player in digital transformation for leading organisations across emea  with a revenue of €761m  together  we share a common vision of transforming technology to create value for our clients  partners and employees in a world where technology is developed for people   want to apply? nível de experiência pleno-sênior setor tecnologia da informação e serviços tipo de emprego tempo integral funções de trabalho tecnologia da informação
2,Full Stack .NET AWS Developer (M/F) - Lisboa,BOLD by Devoteam,"Lisboa, Lisboa, Portugal",501-1.000 funcionários,0 candidatos,Anunciada há 2 semanas,0,0,0,0,0,0,0,0,0,0,https://www.linkedin.com/jobs/view/2372959501/?eBP=CwEAAAF3Sp3PQ-J0AiE2iFUkCfYVoiJv8cabuvzWueUHW16MWJkXlWUKK_fKh0EsBqNudXc7rQh_1fPTmHGbi7MKywUqb-qOHaLpkN8_oXsoCLsA9FzKUSF5BECZK-d4XD8iOmdy4PsyhZ6N9KmBkSoFy4QCuOJ94aWhyzSMN88CfHpt27c5aNW6OXcRFaQBqAlVxxs4v0ssBVvdQcfD6uUzuvUK3MFMC0CZaDoEFs1VaGDzEAgTAGfAwH_W-AfCrSfQ8VKpMMWhhk0-S0oDN2lbzxQwyzrGJnrBxz2kMht9-21A39VmMu0gT6mgY56DYhvN4uL9Rh0xOCeR3sFuQYMRWiWAMNUJhLEY&recommendedFlavor=SCHOOL_RECRUIT&refId=MkrxUvXcDbelL7EdEcOicw%3D%3D&trackingId=6rA4dtv5KajtWzOKN0sxew%3D%3D&trk=flagship3_search_srp_jobs,the passion for what we do has no boundaries  our resilience is authentic and our courage is limitless when facing new challenges  we are proud of the culture we have built together  we are proud of our people at the service of technology  #techforpeople    our positioning about covid-19: due to the particular times we are facing and in order to protect our candidates and interviewers health and well being  all interviews will be held through video conference  we've created a remote onboarding process to ensure that new starters have all the knowledge they need to be able to start this new career phase    about the offer   we are currently looking for  full stack  net aws developer   the desired qualifications and skills are: · very strong  net and solid understanding of oo principles  · very deep knowledge of the amazon web services product catalogue  · dynamodb   document database experience  · experience with micro services and containerization   fargate experience a plus  · experience with using html  css and css pre-processors  sass  less  etc    · good knowledge of ui automation test frameworks  e g  selenium web driver   · advanced web development skill with angular2  typescript   building complex applications and components  · solid experience with continuous integration and continuous delivery tools  · agile development software life cycle   these are our mindsets and what you can expect from us: fair & courageous we promote ask me anything sessions  a moment where any employee can question  suggest or share any topic live with the ceo  we have a referral program that financially recognizes our employees for helping the company grow  ambition & results we believe in supporting the personal and professional growth of our employees  that’s why we have a differentiated career path management supported by a transparent model  capable of identifying  developing and adding value to your skills  we’ve created a strategic gatherings concept  a moment where information about the company's performance is shared and where we discuss short-term prospects for the future  we are focused on a thought leadership program that aims to promote and develop our employees' talent  experience and passion for technology  learning & innovating we hold informal meetings to promote knowledge sharing moments between our employees and the technological community  we invest in the continuous training of our employees through technical and behavioral workshops  language classes  external funded training and certifications and by establishing partnerships with training providers  caring & sharing we created the blue angels  a social and environmental responsibility program that puts the solidarity of our employees at the service of the community  we love some good socializing moments and we hold as many as we can  from monthly themed meetings to family events  we never say no to a good party  nível de experiência pleno-sênior setor tecnologia da informação e serviços tipo de emprego tempo integral funções de trabalho tecnologia da informação
4,Full Stack Developer - AWS/.Net/HTML5 (M/f) - Lisboa,BOLD by Devoteam,"Lisboa, Lisboa, Portugal",501-1.000 funcionários,3 candidatos,Anunciada há 2 semanas,0,0,1,0,0,0,0,0,0,0,https://www.linkedin.com/jobs/view/2372966115/?eBP=CwEAAAF3Sp3PQ3pxPoeCVgpa6a1uEMfpkYawBTtUchSaiuhzYHphUoYHBOhadXyhw_oaVLVteg2aRC_noEaMBRmTJYEz3gNjBWtAajIzDaHs6HcJ1-9dC54tT2152HxgkWKUi2116zPBa6BgCYH8VoW17po7Ld7iSYFga37GZzVw4SCbVuuf1rkCnsvrWLWKBZaOoyGsOTwv0bh9vulFWSQmAIGlacBjXvXnM-K-pmEoscXMHtjZTXRz5ypYP1yRfBQ7jzBRhnqnjeeAEmZYOZIgkBTzEy0of6fC2c6SDqRVi5zCATcdIoUqnyBGjsZ4-gwohQG2cGZS_oMIhwgOpiCxLxJ_U4Lld5D6&recommendedFlavor=SCHOOL_RECRUIT&refId=MkrxUvXcDbelL7EdEcOicw%3D%3D&trackingId=8RylUa2C9Bh88b8N6TQoeQ%3D%3D&trk=flagship3_search_srp_jobs,the passion for what we do has no boundaries  our resilience is authentic and our courage is limitless when facing new challenges  we are proud of the culture we have built together  we are proud of our people at the service of technology  #techforpeople    our positioning about covid-19: due to the particular times we are facing and in order to protect our candidates and interviewers health and well being  all interviews will be held through video conference  we've created a remote onboarding process to ensure that new starters have all the knowledge they need to be able to start this new career phase    about the offer   we are currently looking for  fullstack:  job responsibilities   role  · work closely with business sponsors to ensure the solution meets the needs of the fixed income trading desks  · helping to define the cloud strategy for the project  including the selection of the right aws components to support the project  · contribute to the technical design and ensure all aspects of the system architecture are well documented  · work closely with partner technology teams and to collaborate effectively  · have a deep knowledge of c# and the  net framework and how to develop  net services for the cloud   technical skills required  · very strong  net and solid understanding of oo principles  · very deep knowledge of the amazon web services product catalogue  · dynamodb   document database experience  · experience with micro services and containerization   fargate experience a plus  · experience with using html  css and css pre-processors  sass  less  etc    · good knowledge of ui automation test frameworks  e g  selenium web driver   · advanced web development skill with angular2  typescript   building complex applications and components  · solid experience with continuous integration and continuous delivery tools  · agile development software life cycle  these are our mindsets and what you can expect from us: fair & courageous we promote ask me anything sessions  a moment where any employee can question  suggest or share any topic live with the ceo  we have a referral program that financially recognizes our employees for helping the company grow  ambition & results we believe in supporting the personal and professional growth of our employees  that’s why we have a differentiated career path management supported by a transparent model  capable of identifying  developing and adding value to your skills  we’ve created a strategic gatherings concept  a moment where information about the company's performance is shared and where we discuss short-term prospects for the future  we are focused on a thought leadership program that aims to promote and develop our employees' talent  experience and passion for technology  learning & innovating we hold informal meetings to promote knowledge sharing moments between our employees and the technological community  we invest in the continuous training of our employees through technical and behavioral workshops  language classes  external funded training and certifications and by establishing partnerships with training providers  caring & sharing we created the blue angels  a social and environmental responsibility program that puts the solidarity of our employees at the service of the community  we love some good socializing moments and we hold as many as we can  from monthly themed meetings to family events  we never say no to a good party  nível de experiência pleno-sênior setor tecnologia da informação e serviços tipo de emprego tempo integral funções de trabalho tecnologia da informação
6,Full-Stack Web Developer,Johnson Controls,"São João da Madeira, Aveiro, Portugal",+ de 10.001 funcionários,3 candidatos,Anunciada há 1 dia,1,0,0,0,0,0,1,1,0,1,https://www.linkedin.com/jobs/view/2397937028/?eBP=JOB_SEARCH_ORGANIC&recommendedFlavor=SCHOOL_RECRUIT&refId=MkrxUvXcDbelL7EdEcOicw%3D%3D&trackingId=1lpBFqwRJHAyubmppdLlGg%3D%3D&trk=flagship3_search_srp_jobs,what you will do  every day  we focus on our common goal of creating and implementing innovative solutions for retailers  and we do this by working together and applying deep technical expertise to help our customers solve pressing challenges  with a collective passion to make an impact  together with your cross functional development team  you will be a part of the design and development of continuously integrated and innovative and custom-made inventory management system used by one of the biggest retailers around the world in over 1000 stores  built using emerging technologies like rfid we give retailers the visibility they need to take their business to the next level  we focus on solving today’s challenges while constantly asking ‘what’s next?’ so  what’s next in your future?  how you will do it  contribute to design and development of new cross-browser web applications   contribute to the technical design and implementation of a cross-browser  chrome  internet explorer  firefox etc   solutions following the industries trends and best practices  contribute to restful api definition and technical design and development of microservices with low-latency  high-availability  performance and scalability in mind guarantee services continuous deployment ability through a continuous integration workflow be ready to learn and adapt to new technologies in a fast-paced cloud environment  experiência e competências desejadas   what we look for  full-stack web developer  front-end  back-end  academic degree in it or similar area  3 years of working experience  minimum of b2 level english front-end background in javascript development  preferably with spa experience  experience in designing building any responsive layout  knowledge in angular   angular  react or vue is valued  angular preferred   typescript know-how will be valued  familiarity with module loaders like gulp is a plus  experience with d3 is valued  back-end experience as a java developer  preferred spring framework experience  strong understanding of rest api design relational database knowledge required experience with rest apis    our benefits we provide meaningful opportunities to learn from the best in the industry and work on innovative solutions  besides a very pleasant and international work environment johnson controls offers foods & drinks  massages  transport  health and life insurance  events and leisure spaces  you will be based on of our modern offices in são joão da madeira or braga with daily transport from vila nova da gaia and aveiro    surroundings  bringing you to the são joão da madeira office in the blink of an eye!   nível de experiência pleno-sênior setor tecnologia da informação e serviços software varejo tipo de emprego tempo integral funções de trabalho tecnologia da informação engenharia
8,Full Stack Engineer (Stockholm based),Hemnet,"Lisboa, Portugal",51-200 funcionários,18 candidatos,Anunciada há 3 semanas,1,0,0,1,0,0,0,1,0,0,https://www.linkedin.com/jobs/view/2335228831/?eBP=JOB_SEARCH_ORGANIC&recommendedFlavor=ACTIVELY_HIRING_COMPANY&refId=MkrxUvXcDbelL7EdEcOicw%3D%3D&trackingId=RtoikIa7aNieUiRYEZnhtA%3D%3D&trk=flagship3_search_srp_jobs,hemnet  sweden's biggest property portal  is many swedes' favorite place online  here people find joy  inspiration and – most important - their new homes  as a developer at hemnet you will face fun challenges when developing ideas for products affecting people's lives in a positive way   hemnet is now looking for a fullstack developer for our officies based in stockholm  sweden  if you are an applicant living outside of sweden we would assist you with your relocation to stockholm   initiate discussions and make design decisions with us  you’ll be involved in developing web applications in one of our six development teams  the teams at hemnet are self-propelled and cross-functional  which means that you’ll be a part of the entire product development cycle  you’ll have a great deal of involvement in the development of hemnet's products and services - everything from taking quick design decisions to running your own initiatives  we work data-driven in close collaboration with each other- exploring small things  test and iterate  we validate against real data so we don't have to waste time and instead learn a lot of new insights   what you’ll do at hemnet as fullstack developer: be an important part of a cross-functional team with joint product responsibility - together we bring the product forward  take quick decisions with an experimental approach   be involved in the whole cycle of the product - from idea vision to production  and from implementation to support   write tests for your applications and do your own deployments to our staging and production environments in aws   work closely with product managers and other roles within ux design  user research  data analysis and frontend   be part of an agile team where retros  sprints  demos and continuous delivery are part of the everyday work life  work in a friendly and caring company culture where transparency  work-life balance and well-being are high up on the company's agenda    what we want from you:   understand the challenges of managing a larger website with many visitors  a large amount of data and swift changes in structure and content  share knowledge and contribute to discussions around technologies and your projects   take part in product development  be a true team player    technologies at hemnet: javascript  react    ruby  rails  graphql docker postgresql aws  as one of our 30 developers     … you’ll release daily  what you build in the morning can be in production for our millions of visitors already after lunch  thanks to our large amount of traffic  we quickly get good feedback from experiments  the possibilities are great  you get the chance to test and learn new things and we solve challenges together    we do  of course  have developer breakfasts  hack days and trainings to help you try out new technology and grow in your role   if you think it is exciting to join and take sweden's largest housing portal to the next step - do not hesitate to send your application away! nível de experiência pleno-sênior setor imobiliário tipo de emprego tempo integral funções de trabalho engenharia tecnologia da informação
10,Full Stack Software Engineer,BOLD by Devoteam,"Lisboa, Portugal",501-1.000 funcionários,0 candidatos,Data do anúncio,1,1,0,1,0,1,0,0,0,1,https://www.linkedin.com/jobs/view/2399456981/?eBP=CwEAAAF3Sp3PQ2Lqolq5I2C1v_lY_20S7blmKvkRMzTOq5u0R-5utccOzqM5xECXdsNFuOac_a2dZAQy0A1o4ohvekSZZbxJC7B6kRB6ilE42JbjNmqsFNzmsMSzJbMb7tJ4ItJ6TWZo7c1hCV_flT_wPKmhWoarlpYy_luxCcgKpMfPoa2kFC8_FZZAcPjwXWLAeandGtCl9K5LIyQBGM9j2rGW_xuic5kw3ddZQdmGruXpXpSygR7-_hsWNg0YmuwrZ3sRWvDi-95NBv_4ks7KHa5YwdqCBnwv0mxHBzd5lsHGMj0L4hp1YRm3gw8QnTEK0Aai6-QXd9TxYJAAuYvrcG5RwkVUp_xo3rDCcy8K&recommendedFlavor=SCHOOL_RECRUIT&refId=MkrxUvXcDbelL7EdEcOicw%3D%3D&trackingId=O5OcC2DTTA6LH6ZpVU%2FsQA%3D%3D&trk=flagship3_search_srp_jobs,anunciada por letícia ferreira talent spotter at bold by devoteam envie inmail the passion for what we do has no boundaries  our resilience is authentic and our courage is limitless when facing new challenges  we are proud of the culture we have built together  we are proud of our people at the service of technology  #techforpeople   our positioning about covid-19: due to the particular times we are facing and in order to protect our candidates and interviewers health and well being  all interviews will be held through video conference  we've created a remote onboarding process to ensure that new starters have all the knowledge they need to be able to start this new career phase   about the offer we are currently looking for a full stack software engineer to: participate in the design and creation of scalable software  collaborate in all phases of the sdlc lifecycle process  write clean  functional code on the front and back-end  develop and design restful services and apis  develop functional databases  applications and servers to support software on the back end   the desired qualifications and skills are: bachelor’s degree in the it area or equivalent  previous experience working in similar functions  working experience with server side languages such as  net  java  python  php or ruby  solid experience with fundamental front end languages  such as html  css and javascript  knowledge of databases such as sql server or oracle  fluency in english  written and spoken    these are our mindsets and what you can expect from us: ●     fair & courageous ○     we promote ask me anything sessions  a moment where any employee can question  suggest or share any topic live with the ceo  ○     we have a referral program that financially recognizes our employees for helping the company grow  ●     ambition & results ○     we believe in supporting the personal and professional growth of our employees  that’s why we have a differentiated career path management supported by a transparent model  capable of identifying  developing and adding value to your skills  ○     we’ve created a strategic gatherings concept  a moment where information about the company's performance is shared and where we discuss short-term prospects for the future  ○     we are focused on a thought leadership program that aims to promote and develop our employees' talent  experience and passion for technology  ●     learning & innovating ○     we hold informal meetings to promote knowledge sharing moments between our employees and the technological community  ○     we invest in the continuous training of our employees through technical and behavioral workshops  language classes  external funded training and certifications and by establishing partnerships with training providers  ●     caring & sharing ○     we created the blue angels  a social and environmental responsibility program that puts the solidarity of our employees at the service of the community  ○     we love some good socializing moments and we hold as many as we can  from monthly themed meetings to family events  we never say no to a good party   about bold we are focused on developing and delivering innovative technological solutions through a unique combination of technology expertise and agility  maximizing business value for our clients  our focus when it comes to supporting our client’s digital journey is about clear choices that build & develop skills in a very targeted way  since 2018  bold by devoteam has been part of the devoteam group  a global leading player in digital transformation for leading organisations across emea  with a revenue of €761m  together  we share a common vision of transforming technology to create value for our clients  partners and employees in a world where technology is developed for people   want to apply? send me your cv to leticia ferreira@devoteam com   nível de experiência não aplicável setor tecnologia da informação e serviços tipo de emprego tempo integral funções de trabalho tecnologia da informação engenharia
