,Job position,Company,Location,Dimension,Candidates,Post time,JavaScript,Python,C#,Ruby,.Net,SQL,Angular.js,React.js,Node.js,Java,Links,Body
12,Full-stack Developer,East Atlantic Engineering,"Lisboa, Lisboa, Portugal",11-50 funcionários,1 candidato,Anunciada há 1 mês,1,0,0,0,0,0,1,1,0,0,https://www.linkedin.com/jobs/view/2358971231/?eBP=JOB_SEARCH_ORGANIC&refId=MkrxUvXcDbelL7EdEcOicw%3D%3D&trackingId=OzZdFQWvF2OiR2MH8RmVIQ%3D%3D&trk=flagship3_search_srp_jobs,at east atlantic engineering  permanent   in lisbon  portugal expires at: 2021-02-28  working for global brands and prestigious agencies  east atlantic engineering develops integrated digital solutions for international clients since 2003  we are an energetic team of consultants  designers  and developers committed to first-class project delivery   we are looking for a full stack developer to enhance our team's skillset and critical thinking  who enjoys having product ownership and push it to the next level   what you will do work closely with a strong and highly motived multidisciplinary team build and maintain high-quality applications and services push the team's boundaries by searching for new trends and understand them as viable options for our products   main requirements 4 years working experience on small to medium scale digital services or products  html5  css3  sass and javascript  es6  experience  experience with at least one php framework  laravel  codeigniter  symfony   experience with relational databases and mysql   comfortable with a linux environment deploy and maintain ci cd pipelines across multiple environments experience with docker containerisation and clustering self-motivated  responsible and eager to learn more  nice to have   frameworks knowledge: backbone    react  angular  or vue    experience working with agile methodologies  accessibility knowledge and a keen eye for ui details and implementation   benefits & perks inspiring work environment with a highly experienced team of professionals  in-house software development  no outsourcing   human centred culture of trust and responsibility possibility to work on exciting and ambitious projects for international clients  attractive salary and conditions  health insurance  free public transport  coffee  tea  sweets and fresh fruit  a nice kitchen and lounge area to relax and get together  stunning office in the centre of lisbon  with a nice balcony with great views  nível de experiência assistente setor tecnologia da informação e serviços software recrutamento e seleção tipo de emprego tempo integral funções de trabalho engenharia tecnologia da informação
14,Full Stack Developer,Applied Blockchain,"Porto, Porto, Portugal",11-50 funcionários,9 candidatos,Anunciada há 3 semanas,0,0,0,0,0,0,0,1,1,0,https://www.linkedin.com/jobs/view/2370266222/?eBP=JOB_SEARCH_ORGANIC&recommendedFlavor=ACTIVELY_HIRING_COMPANY&refId=MkrxUvXcDbelL7EdEcOicw%3D%3D&trackingId=889mluK01qoJBknlqnCzhw%3D%3D&trk=flagship3_search_srp_jobs,applied blockchain is an innovative applications development company  focussed on distributed ledger and confidential computing technologies  based at level39  europe’s largest fintech accelerator in london’s canary wharf and in porto  portugal  applied blockchain has an expert team of developers creating cutting-edge solutions for disruptive startups and corporate clients in banking and finance  energy  aviation  automotive  shipping  telecommunications and social impact sectors  our clients already include shell  also an investor in the company   klm  lloyds register  toyota  united nations and we’re advising the uk government  we are building a new generation of decentralised and confidential solutions  working through some of the most interesting technical problems in this field such as identity management  transaction anonymity  encryption  cryptography and data security   what you’ll be doing build node   backend integrated with react   frontend using  on rest api's develop cutting-edge software solutions for startup and corporate clients develop decentralized applications work alongside other developers in the team to create secure  performant  resilient business applications engage with clients to understand their product business proposition in trading  energy  shipping  mobility  supply chains  and financial services  create automated tests peer code review configure deployments using docker and kubernetes take responsibility for features you deploy into staging and enterprise production environments   requirements enterprise architecture enterprise software 5  years professional experience developing node   web applications strong experience and knowledge of design and architectural patterns strong communication skills knowledge of postgresql react    nice to have  bachelor's degree  nice to have  devops  docker  kubernetes  nice to have    benefits 22 days holiday 1000 euro training budget and up to 5 training days   year healthcare insurance meal cards team meeting lunch flexible work from home policy nível de experiência pleno-sênior setor tecnologia da informação e serviços software internet tipo de emprego tempo integral funções de trabalho engenharia
16,PHP Developer Full Stack,SmartDigit,"Lisboa, Lisboa, Portugal",2-10 funcionários,0 candidatos,Anunciada há 1 semana,1,0,0,0,0,1,1,0,1,0,https://www.linkedin.com/jobs/view/2399422178/?eBP=JOB_SEARCH_ORGANIC&recommendedFlavor=JOB_SEEKER_QUALIFIED&refId=MkrxUvXcDbelL7EdEcOicw%3D%3D&trackingId=N3to6MKwESiRNf%2FT1%2B6a%2Fw%3D%3D&trk=flagship3_search_srp_jobs,a smartdigit é uma empresa de desenvolvimento de software empresarial que procura um profissional para desempenhar funções de php developer para integrar num projeto de uma aplicação saas multiplataforma para diversos clientes em todo o mundo   responsabilidades desenvolvimento de novos serviços e melhorias das funcionalidades existentes  pesquisa e implementação de novas tecnologias e ferramentas no ambito do projeto  colaboração e envolvimento numa pequena equipa de desenvolvimento   qualificações  um pouco sobre ti 3 ou mais anos de experiencia em desenvolvimento web  experiência comprovada com javascript  es6   php frameworks  preferencialmente laravel   scss css  docker  sql  espírito de iniciativa e atenção aos detalhes  criativo a   inovador a  e com espírito de equipa  aprendiz rápido  novas linguagens   tecnologias  e disposto a melhorar a si mesmo  apaixonado por desenvolvimento de software  boa capacidade de comunicação  organização  facilidade de relacionamento interpessoal   damos valor aos conhecimentos metodologias agile  cloud services  aws  azure  etc   experiencia jira  bitbucket e cd ci  module builder  webpack  grunt   express  socket io  mongo  oauth  angular  node    oferecemos remuneração de acordo com a experiência demonstrada  tipo de contrato: sem termo  enquadramento numa empresa baseada nas relações  na inovação  na simplicidade e eficiência  excelente ambiente de trabalho criativo e colaborativo  oportunidade de integrar uma empresa jovem e ambiente internacional  seguro de saúde  formação inicial e contínua  flexibilidade no horário de trabalho e trabalho remoto   envie a sua candidatura por email para  local de trabalho: linda-a-velha nota: apenas iremos considerar as candidaturas de cidadãos da união europeia ou com autorização de residência em portugal para exercício de atividade profissional subordinada  nível de experiência assistente setor tecnologia da informação e serviços software internet tipo de emprego tempo integral funções de trabalho engenharia tecnologia da informação
18,Web Developer,ToucanTech,"Lisboa, Lisboa, Portugal",11-50 funcionários,12 candidatos,Anunciada há 1 semana,1,0,0,0,0,0,0,0,0,0,https://www.linkedin.com/jobs/view/2390180574/?eBP=JOB_SEARCH_ORGANIC&refId=MkrxUvXcDbelL7EdEcOicw%3D%3D&trackingId=nDtEaNFyjiskvJcWz2%2FMBw%3D%3D&trk=flagship3_search_srp_jobs,start date: as soon as possible reporting to:lead developer & product director salary:eur 1 000 ? 1 200 per month  for 14 months ? equivalent to eur 14 000 ? 16 800 per year  location:lisbon  remote  cascais co-work  other perks:22 paid days holiday per year    national holidays  fun working environment  training and support  annual bonus opportunity and some flexibility over working hours and location we are toucantech  a fast-growing saas community database software used by schools  charities and companies to manage their memberships  alumni  fundraising  marketing and careers activities  with 200 customers internationally  we provide an easy all-in-one system that combines a powerful admin portal  for managing records and content  with a flexible website  for community members to login and interact  and mobile app   requirements  we are looking for a talented  smart and enthusiastic developer to join our team helping to enhance our software and build exciting new features  you?ll need the following coding experience:  required skills  php mysql css html5 javascript good level of english to communicate with team and to document work  desirable skills  previous experience of api design development  app dev  flutter  and automated testing scripts code review - experience with git  github bootstrap and mobile ui jquery  benefits  salary % package this is a full-time contractor position with a starting salary between eur 1 000 and eur 1 200 p m and 22 paid holiday days a year in addition to public holidays in portugal  we will conduct a salary review after 6 months of working in the company and provide the opportunity for fast career growth  an annual bonus linked to company performance and ad hoc bonuses based on personal performance   some of the benefits of this role  full stack experience - manage the coding process from start to finish flexible working hours and style training and support to develop your skills and career regular team events  meetups and birthday cake!  the application  we will ask you to complete a coding test as part of the application process  we are not able to sponsor non-eu work visas  so you must have the right to work in the eu  portugal  thank you! nível de experiência assistente setor marketing e publicidade tecnologia da informação e serviços software tipo de emprego tempo integral funções de trabalho engenharia tecnologia da informação
20,Software Engineer,Loggi,"Lisboa, Lisboa, Portugal",1.001-5.000 funcionários,16 candidatos,Data do anúncio,0,1,0,0,0,0,0,0,0,0,https://www.linkedin.com/jobs/view/2398321122/?eBP=JOB_SEARCH_ORGANIC&recommendedFlavor=SCHOOL_RECRUIT&refId=MkrxUvXcDbelL7EdEcOicw%3D%3D&trackingId=wZa%2Fy8%2FqVRJqkRh5Mt%2BcsQ%3D%3D&trk=flagship3_search_srp_jobs,"_ our business  through technology  mobile  ai  automation  iot   we have created a next-generation logistics network and we are  in an unprecedented way  positioning ourselves to unleash the growth of a new trade in brazil with a fast  cost-effective and reliable logistics solution   by the end of 2021  we want to be present in all brazilian cities and reach the milestone of 5 million deliveries per day by 2025   with softbank  microsoft  ggv capital and others  the new investment round has brought loggi’s valuation up to us$1 billion hitting the unicorn mark!  “our mission is to deliver everything to everyone everywhere as quickly as possible  we want to connect brazil and value  for example  amazonian handicrafts  enabling artisans to sell without intermediaries to consumers in any region ”  fabien mendez  ceo - chief executive officer   _ our engineering team  loggi’s engineering team is focused on solving highly complex problems  mixing up very experienced professionals and early career employees  in a fortified environment by learning  sharing of experiences and respect  together  we will build the logistics network of the country  developing unique algorithms  systems and processes   our leaders have already left their mark in the national and worldwide tech scenario  working in companies like google and uol  they are engaged in finding how to develop a group of more than a thousand programmers to explore the knowledge borders and connect the country   we believe and invest in everyone's potential  ""over the next 5 years we want to train brazil’s future ctos! here  we have a structured development program ""  davi reis  cto - chief technology officer   requirements  _ responsibilities  you will architect and develop high quality scalable solutions  being part of multidisciplinare squads seeking an amazing and efficient experience for the users!  as the technical focus point on a squad  we’ll count on you on the development of ideas and solutions that solve complex problems and generate great results for the team   loggi’s engineering team works with a wide variety of technologies and techniques to solve our challenges  we try to see beyond the buzzwords to develop software in a pragmatic and efficient way   to spark your curiosity  we work on python django  kotlin micronaut  predictive models trained with sklearn and keras tensorflow  native and hybrid apps  and pwas  algorithms of optimization based on or-tools  systems in azure and aws  with and without kubernetes  in addition we also use looker and elk for dashboards and analysis   _ requirements 1  years of relevant work experience in software development or 2  years in academic   technical field  regardless of language technology  good knowledge of algorithms and data structure  experience working in a collaborative way  with others engineers  product managers and designers  autonomy  analytical mindset  problem solving abilities supported by best practices in coding  willingness to work full-stack and easy transition between technologies and languages  familiarity with agile trends    benefits  _ our benefits  for a healthier life  we provide you  health plan with national coverage  without discounts!   flexible hours with the possibility of working at home according to function and demand  extra holiday days  we support you with  above average remuneration of the best technology companies in portugal  with annual reviews  meal voucher  daycare  educational voucher for children up to 07 years  we develop you with  immersion week in all areas of the company  our famous xboarding  frequent knowledge exchanges with internal and external professionals  individual development plan updated every six months  feedback culture and opportunity to work according to the squad concept  working with big names in the history of technology in brazil & portugal  possibility to develop new algorithms with the challenge of creating the new generation of logistics  we help parents with  health for your children at no extra cost  some of our offices also have  massage  manicure  pedicure at reduced costs  pet day  game rooms with video games  pool and others  locker room and spaces to store your bike or scooter safely  marketplace selling quick meals  drinks and snacks  _ our culture  inclusive  determined and visionary that's who we are and how we work here   we are already more than 1000 loggers  we are hi-tech  little conservative and we are always up to date! above all  we hope that everyone is eager to learn and acquire new knowledge quickly   we look for an increasingly inspiring and welcoming work environment  and we very much hope that you will help us to maintain our culture even at an accelerated pace of growth   we are very happy to be recognized among the best startups to work according to linkedin and glassdoor  among the 10 most innovative startups by forbes brasil and also to be certified by great place to work   being part of loggi must mean that you can be who you are - or want to be  we look for a more accessible country  thus  we can say that respecting the needs of different people is our reason for existing  this is history  it is culture  it is respect   important all loggi jobs are also open to people with disabilities  pwd    this job description is written in english because we already have a technology office in europe  and as we are hiring professionals from all over the world  you can have interactions with professionals who do not speak portuguese   essa descrição de vaga está escrita em inglês porque nós já temos um escritório de tecnologia na europa e  como estamos contratando profissionais de todo o mundo  você pode ter interações com profissionais que não falam português   let's go together? nível de experiência pleno-sênior setor tecnologia da informação e serviços internet recursos humanos tipo de emprego tempo integral funções de trabalho engenharia"
22,Junior Full Stack Software Developer,Elevus,"Porto, Porto, Portugal",18 no LinkedIn,13 candidatos,Anunciada há 2 meses,1,0,0,0,0,0,1,0,0,1,https://www.linkedin.com/jobs/view/2344418106/?eBP=JOB_SEARCH_ORGANIC&recommendedFlavor=SCHOOL_RECRUIT&refId=MkrxUvXcDbelL7EdEcOicw%3D%3D&trackingId=TNH52Pt5Rtk7olmCXFMcdw%3D%3D&trk=flagship3_search_srp_jobs,perfil formação superior em engenharia informática ou similar  experiência em várias tecnologias como: java  jquery scrum  html  mysql e javascript  experiência em desenvolvimento de testes  bons conhecimentos em maven  jenkins  eclipse  angular  gosto pelo desenvolvimento e trabalho em equipa  gosto pela partilha de conhecimento e sentido deinterajuda  proatividade e ambição  oferta integração em equipa jovem e dinâmica aprendizagem contínua  remuneração de acordocom a experiência demonstrada  nível de experiência assistente setor tecnologia da informação e serviços recrutamento e seleção recursos humanos tipo de emprego tempo integral funções de trabalho engenharia tecnologia da informação
24,Full-Stack Developer (m/f),Michael Page,"Porto, Porto, Portugal",5.001-10.000 funcionários,0 candidatos,Anunciada há 1 dia,1,1,0,0,0,0,0,1,1,1,https://www.linkedin.com/jobs/view/2397502336/?eBP=JOB_SEARCH_ORGANIC&recommendedFlavor=SCHOOL_RECRUIT&refId=MkrxUvXcDbelL7EdEcOicw%3D%3D&trackingId=Zu1b%2BDhI2emhD6fgkUkc%2Bw%3D%3D&trk=flagship3_search_srp_jobs,full-stack developer  m f  multinational german company new software campus  about our client  our client is an international technology group with about 10 000 employees  more than 100 locations worldwide and a common goal: turn entrepreneurial thinking into customer success and shape the technological change  in the business areas digital  pharma  supply chain  tissue and tobacco  they offer products  solutions and services that inspire  they act fast to customer needs  they execute ideas seamlessly  and with their innovations they create added value for their customers  in doing so  they are increasingly building on ecosystems that solve the challenges of today and tomorrow   job description  as a full-stack developer  you are responsible for building and running our systems  web  mobile applications and backend services   you will collaborate with product owners  ux designers  shopfloor consultants  data scientists and other engineers to develop user-centric features  you will use your experience  knowledge and skills to design  implement & test  deploy and operate a diverse ecosystem of microservices  running on aws  and applications  web and mobile   now and then  you will put your excellent problem-solving and troubleshooting skills into action to restore faulty services   the successful applicant  experience in designing  developing  and deploying web or mobile applications  ios android  experience in modern frontend frameworks  e g  react or react native is a plus  familiar with the concepts and approaches for state management in frontend applications familiarity with graphql and one of its client implementations  such as apollo client is a plus familiarity with the concept of micro-frontend architecture is a plus experience in frontend automated testing with modern tools  e g  jest and react testing library is a plus  experience with end-to-end testing and frameworks  e g  cypress or detox is a plus  is an advantage experience with rest api  graphql or grpc design  implementation & testing experience in any of the languages: jvm languages  java 7 8   kotlin   javascript 6   typescript  node   python experience with backend frameworks such as spring boot or flask familiar with relational databases  postgres   nosql databases  aws dynamodb  familiar with aws services familiar with the concept and implementations of infrastructure-as-code  e g  terraform or ansible  experience with test automation  beyond unit testing  and concepts such as tdd  bdd experience with modern ci cd experience working in a devops team is a plus experience in scrum  kanban or scrumban fluency in english  other languages are a plus experience in iiot and manufacturing industry is a plus  what's on offer  the opportunity to make an impact as part of a talented international team of experienced software developers  a supporting environment to explore and grow  the opportunity to work independently and shape your area of work according to your strengths  learn about and help shape modern software development processes   contact: filipa barros quote job ref: jn-012021-1999454 nível de experiência assistente setor telecomunicações biotecnologia tecnologia da informação e serviços tipo de emprego tempo integral funções de trabalho engenharia tecnologia da informação
