,Job position,Company,Location,Dimension,Candidates,Post time,JavaScript,Python,C#,Ruby,.Net,SQL,Angular.js,React.js,Node.js,Java,Links,Body
14,Microsoft Dynamics CRM Consultant,Capgemini,"Lisboa, Lisboa, Portugal",Check link,7 candidatos,Anunciada há 3 meses,0,0,1,0,0,0,0,0,0,0,https://www.linkedin.com/jobs/view/2295692405/?eBP=JOB_SEARCH_ORGANIC&recommendedFlavor=SCHOOL_RECRUIT&refId=lQakYlz2KLe46ZOME9VtCQ%3D%3D&trackingId=bAoXvEed%2FJWV7dBW%2FmGPPg%3D%3D&trk=flagship3_search_srp_jobs,we are hiring microsoft dynamics crm developer!  at capgemini portugal  you will work with some of the industries leading experts  with cutting edge technologies  and a supportive community  you’ll be challenged daily and given strong responsibility from day one   if you have at least 2 years of experience working with microsoft dynamics crm  this opportunity is for you!  we are looking for unrivalled passion for everything microsoft dynamics focused  expertise in ms dynamics 365  crm   more than just an interest in ms dynamics 365 online and office 365  bottoms up understanding of crm – c# development through to architecture design  full life cycle experience on a microsoft dynamics projects  knowledge of microsoft dynamics crm sdk  visual studio and team foundation server  have experience in the broader msft stack  azure  sharepoint  biztalk  and worked to an agile methodology   what are we offering? the chance to work on interesting challenging projects for national and international clients  the opportunity to work in great  dynamic teams  health and life insurance  the possibility of investing on certifications and training  a permanent contract with an attractive compensation package and benefits  nível de experiência júnior setor tecnologia da informação e serviços software recrutamento e seleção tipo de emprego tempo integral funções de trabalho tecnologia da informação
16,Full Stack Developer,Olisipo,"Lisboa, Lisboa, Portugal",Check link,0 candidatos,Anunciada há 1 dia,1,0,0,0,0,1,1,0,0,1,https://www.linkedin.com/jobs/view/2398973570/?eBP=JOB_SEARCH_ORGANIC&recommendedFlavor=SCHOOL_RECRUIT&refId=lQakYlz2KLe46ZOME9VtCQ%3D%3D&trackingId=GtfjN3CIE%2F%2BzPR0MVGt4%2FA%3D%3D&trk=flagship3_search_srp_jobs,full stack developer:olisipo descrição do emprego: full stack developer id:  8950976  data   09-10-2020  empregador   olisipo  país da emprego   portugal  distrito   lisboa  categoria s    informática e tecnologias descrição da empresa a olisipo é uma das principais e mais sólidas referências nacionais como talent recruiter  talent builder e talent care na área das tecnologias de informação   a nossa missão é encontrar o melhor projeto para cada pessoa e  para cada empresa  o melhor talento na área das tecnologias de informação   #connectingitpeople  descrição do anúncio  accredited as ?best talent managers? for seven years in a row  at olisipo we excel for our transparent relationship with all our collaborators  assigning them the most thrilling projects  investing on their training and guiding them attentively  our career management highlights everyone?s potential  it?s achievement and happiness   we are looking for a full stack developer  m f  to integrate a project in lisbon   profile  mandatory tech skills java ee   f  ejb's  jpa   rest and soap based web services  front-end development  javascript  html5  jquery  angular    angular 9   oracle sql and pl sql knowledge  nice to have tech skills junit   jbehave knowledge  bpm engines knowledge  camunda preferencial    f richfaces knowledge  jboss knowledge  soft skills ability to communicate in english effectively  both verbally and in writing  ability to meet project schedules with minimal supervision  team spirit  agile enthusiast  fluent in english  we offer personal accompaniment focused on career management  continuous and personalized training and certification through our own learning center  solidity  trust and growth  competitive salary package with benefits  nível de experiência assistente setor tecnologia da informação e serviços software recrutamento e seleção tipo de emprego tempo integral funções de trabalho engenharia tecnologia da informação
18,Oferta De Emprego: .Net Fullstack Developer,Red IT,"Porto, Porto, Portugal",Check link,0 candidatos,Anunciada há 3 dias,0,0,1,0,0,1,1,0,0,0,https://www.linkedin.com/jobs/view/2398367801/?eBP=JOB_SEARCH_ORGANIC&recommendedFlavor=SCHOOL_RECRUIT&refId=lQakYlz2KLe46ZOME9VtCQ%3D%3D&trackingId=%2BrBLEk7zS5qjLSnij3SEmg%3D%3D&trk=flagship3_search_srp_jobs,distrito: porto - concelho: porto  oferta net fullstack developer » red it » ref: 7085331 » 2-11-2020 » porto » informática   programação    detalhe da oferta  esta pode ser a tua oportunidade  tu decides  keywords:  net  c#  html  css  sass  angular  typescript  sql server   net core  se tens formação base em engenharia informática ou equivalente  experiência superior a 2 anos em desenvolvimento c# net conhecimentos de  net core  experiência com html  css e sass experiência com angular e typescript conhecimentos de modelação de dados em sql server fluência em inglês  e se estás na zona norte e procuras uma oportunidade como  net fullstack developer  decide pelo melhor  a equipa ? é top  queres apostar? o acompanhamento ? follow up contínuo  estamos sempre ao teu lado  o espírito ? trabalhar e ser feliz? provamos-te que é possível! o desenvolvimento profissional ? um novo mundo à tua disposição  vem escolher por onde ir  wolfpack ? descobre o que é ser red  todos os dias!  ainda não te convencemos? vamos tirar-te todas as dúvidas  responder às tuas questões e mostrar-te que porque não há melhor equipa do que a nossa  candidata-te agora através de *** candidatura online *** e vem conhecer a red   what drives you? descobre o que nos move em nível de experiência assistente setor tecnologia da informação e serviços software internet tipo de emprego tempo integral funções de trabalho engenharia tecnologia da informação
20,Senior Software Engineer,Digitech Resourcing,"Porto, Portugal Remoto",Check link,38 candidatos,Anunciada há 2 semanas,1,0,0,0,0,0,0,1,1,0,https://www.linkedin.com/jobs/view/2355620346/?eBP=JOB_SEARCH_ORGANIC&recommendedFlavor=JOB_SEEKER_QUALIFIED&refId=lQakYlz2KLe46ZOME9VtCQ%3D%3D&trackingId=DMuk6i87adKA3ib1OPsf0A%3D%3D&trk=flagship3_search_srp_jobs,anunciada por dan o'brien lead tech recruiter- javascript specialist at digitech resourcing envie inmail are you a senior software engineer skilled in node react? are you a senior software engineer looking for a new and exciting challenge? perhaps you are an engineer with an interest in working on greenfield projects? then look no further as i am currently partnered with one of the most exciting  innovative start-ups in europe who are scaling their javascript team!  you will be developing cutting-edge software solutions whilst utilising your skills in node  react  javascript and you'll ideally have some devops skills to go with  this position is tailored for an engineer who is more comfortable on the backend with stronger node  skills  but you will also be exposed to react    senior software engineer responsibilities:  build node   backend and react   and react native web and mobile applications  integrated using  on rest api's develop cutting-edge software solutions for startup and corporate clients work alongside other developers in the team to create secure  performant  resilient business applications peer code review  senior software engineer requirements: full-stack development javascript node   react   ·       if this sounds like something you're interested in and your confident in your node  skills then please apply now! the role is paying €45 000 - €50 000  nível de experiência pleno-sênior setor recrutamento e seleção tipo de emprego tempo integral funções de trabalho engenharia tecnologia da informação
22,Full Stack Web Developer,Latourrette Consulting,"Lisboa, Lisboa, Portugal",Check link,2 candidatos,Anunciada há 1 semana,1,0,0,0,0,1,0,1,0,0,https://www.linkedin.com/jobs/view/2383625509/?eBP=JOB_SEARCH_ORGANIC&recommendedFlavor=ACTIVELY_HIRING_COMPANY&refId=lQakYlz2KLe46ZOME9VtCQ%3D%3D&trackingId=8gtd7myBTO0Hmr3jP0R0nQ%3D%3D&trk=flagship3_search_srp_jobs,descrição das funções queres estar na vanguarda da automação inteligente? és um a  profissional motivado a  e com sólida experiência no desenvolvimento e entrega de sistemas digitais complexos e implementações de projectos?  então é a ti que procuramos para se juntar à nossa equipa como um a  full stack web developer !  requisitos licenciatura em informática  sistemas de informação ou um campo relacionado min  2 anos de experiência conhecimentos de: html  css  javascript react   restful services  net core 2 e superior entity framework core  sql  motivado a  para trabalhar com soluções tecnológicas inovadoras em ambientes internacionais competências analíticas e de multitasking capacidade de reflexão crítica e de resolução de problemas autónomo a   organizado a  e comunicativo a   vantagens possibilidade de teletrabalho   remote a tempo inteiro pertencer a uma equipa que procura valorizar e reconhecer cada indivíduo  uma equipa dinâmica e flexível que recompensa o mérito e o talento  promovendo o espírito de equipa  a boa vontade e a interacção participação em projectos internacionais desafiantes e altamente inovadores formação contínua e desenvolvimento de carreira oportunidade de carreira a longo prazo  estabilidade e trabalho dentro de um ambiente competitivo que promove o crescimento profissional e pessoal  envia o teu cv para  poderá encontrar o anúncios original publicado em: nível de experiência assistente setor tecnologia da informação e serviços software recrutamento e seleção tipo de emprego tempo integral funções de trabalho engenharia tecnologia da informação
24,Full-Stack Web Developer,MagniFinance,"Lisboa, Lisboa, Portugal",2-10 funcionários,1 candidato,Anunciada há 6 dias,1,0,0,0,0,1,1,0,0,0,https://www.linkedin.com/jobs/view/2390991359/?eBP=JOB_SEARCH_ORGANIC&refId=lQakYlz2KLe46ZOME9VtCQ%3D%3D&trackingId=l7CGAkK8rnjCxBcg3x%2BQkQ%3D%3D&trk=flagship3_search_srp_jobs,at magnifinance  permanent   in lisbon  portugal expires at: 2021-04-18  magnifinance is a financial management platform for businesses that focuses on minimizing operations through automation  bank transactions synchronization  one-click reconciliation and expense registration through document image recognition   where do you fit into this?  you will be part of our development team  building new functionalities in our business management platform that is used by more than 4000 companies  we will work closely with the team of developers to help deliver world-class solutions to our clients   sounds good? see below what you need to apply   our stack back-end  net 4 7  net core 3 1   ef6 signalr  rest and soap soa front-end  angular  databases redis sql server cloud azure and aws  main requirements  3  years of professional software development experience proven experience in web development proficient in  net experience with  net core good understanding of protocols like rest and soap knowledge of service-oriented architecture  soa  proficiency in object oriented relational map  orm  like entity framework  ef6  as well as repository and unit of work patterns work experience with production systems based on microservices and familiarity with its principles and practices  experience with test automation good communication skills interest in understanding how the work delivery brings added value to the customer  creativity and ability to bring new ideas and approaches to the table knowledge of agile devops azure devops pipelines  integrating leading market products  like cypress and postman  newman  knowledge of html  css  javascript and angular   nice to have if you have knowledge of html that is a plus!  benefits & perks  you will have the opportunity to work in the exciting environment of an expanding fin-tech startup  recognized internationally  and contribute to a product with a growing impact on the life of companies everywhere  nível de experiência assistente setor tecnologia da informação e serviços software internet tipo de emprego tempo integral funções de trabalho engenharia tecnologia da informação
26,Full Stack Developer,WIFI4MEDIA,"Faro, Faro, Portugal",2-10 funcionários,1 candidato,Anunciada há 6 dias,1,1,0,0,0,0,0,1,0,0,https://www.linkedin.com/jobs/view/2394040935/?eBP=JOB_SEARCH_ORGANIC&recommendedFlavor=JOB_SEEKER_QUALIFIED&refId=lQakYlz2KLe46ZOME9VtCQ%3D%3D&trackingId=c8BeuW6gr9k9u98bjBEAkw%3D%3D&trk=flagship3_search_srp_jobs,somos uma empresa especializada em desenvolvimento de software onde garantimos soluções adequadas a cada projecto desenvolvido   procuramos para nossos escritórios de faro e ou lisboa experiência mínima de 2 anos em desenvolvimento aplicacional conhecimentos de linguagens de scripting  php  python  conhecimentos em base de dados  mysql e mongodb  conhecimentos em react native conhecimentos em html  css  javascript  bootstrap  experiência em sistemas vcs  preferência git  experiencia em web services e api’s boa capacidade de trabalho em equipa  oferecemos integração numa empresa em expansão internacional  nível salarial compatível com o desempenho  regalias sociais de acordo com a política da empresa  formação e desenvolvimento profissional  contacta!  poderá encontrar o anúncios original publicado em: https:  www itjobs pt oferta 370669 full-stack-developer nível de experiência assistente setor marketing e publicidade tecnologia da informação e serviços software tipo de emprego tempo integral funções de trabalho engenharia tecnologia da informação
